,title,feed_type,link,description,date,image,publisher,stocks,_id
478,LIC Housing: Equity infusion would be preferred over debt capital,news-article,https://www.business-standard.com/article/companies/lic-housing-equity-infusion-would-be-preferred-over-debt-capital-120090301368_1.html,"At 12 per cent tier-1 capital, the recent decision to raise Rs 50,500 crore of debt funds unlikely to address asset quality issues",2020-09-03 18:07:00.000,https://pocket-image-cache.com/direct?url=http://bsmedia.business-standard.com/_media/bs/img/article/2020-02/17/full/1581882310-6298.jpg,"{'logo': 'https://assets.tickertape.in/images/news-publishers/businessstandard.png', 'id': 'www.business-standard.com', 'name': 'Business Standard'}",[{'sid': 'LICH'}],5f50ea4c0c075a1cc5b973e4
479,"Stocks in focus: Coal India, IndusInd Bank, Jindal Steel, LIC Housing Finance, DHFL, Ashok Leyland",news-article,https://www.financialexpress.com/market/coal-india-dhfl-ashok-leyland-jindal-steel-and-power-lic-housing-finance-page-industries-jubilant-industries-stocks-in-focus/2073403/,"A total of 47 companies including Page Industries, Jubilant Industries, Bilcare, Essar Shipping, IL&FS Engineering, MSTC, Panacea Biotec and Zuari Agro Chemicals, will announce their June quarter earnings today.",2020-09-03 09:04:11.000,https://pocket-image-cache.com/direct?url=http://images.financialexpress.com/2020/09/asset1.jpg,"{'logo': 'https://assets.tickertape.in/images/news-publishers/financialexpress.png', 'id': 'www.financialexpress.com', 'name': 'Financial Express'}","[{'sid': 'COAL'}, {'sid': 'DWNH'}, {'sid': 'ESPL'}, {'sid': 'INBK'}, {'sid': 'JNSP'}, {'sid': 'JUBL'}, {'sid': 'LICH'}, {'sid': 'PAGE'}, {'sid': 'PNCA'}, {'sid': 'ZUAR'}]",5f5064e80c075a1cc5b97238
480,"Stocks in the news: Coal India, ONGC, Ashok Leyland, Adani Enterprises & LIC Housing Finance",news-article,https://economictimes.indiatimes.com/markets/stocks/news/stocks-in-the-news-coal-india-ongc-ashok-leyland-adani-enterprises-lic-housing-finance/articleshow/77902197.cms,"LIC Housing said it will seek shareholders’ approval in the upcoming annual general meeting this month to raise up to Rs 50,500 crore.",2020-09-03 07:36:00.000,"https://pocket-image-cache.com/direct?url=http://img.etimg.com/thumb/msid-77902199,width-1070,height-580,imgsize-198498,overlay-etmarkets/photo.jpg","{'logo': 'https://assets.tickertape.in/images/news-publishers/economictimes.png', 'id': 'economictimes.indiatimes.com', 'name': 'Economic Times'}","[{'sid': 'ADEL'}, {'sid': 'ASOK'}, {'sid': 'COAL'}, {'sid': 'LICH'}, {'sid': 'ONGC'}]",5f5053d80c075a1cc5b97217
481,LIC Housing plans to raise Rs 50K cr in Tier-II capital,news-article,https://www.freepressjournal.in/business/lic-housing-plans-to-raise-rs-50k-cr-in-tier-ii-capital,"LIC Housing Finance on Wednesday said it will seek shareholders’ approval in the upcoming annual general meeting this month to raise up to Rs 50,500 crore by issuing debt securities or other hybrid instruments on a private placement basis.",2020-09-03 00:12:28.000,https://pocket-image-cache.com/direct?url=http://gumlet.assettype.com/freepressjournal%2F2020-08%2F754db603-a911-473d-a53b-5e5a574e9e96%2Fpexels_bongkarn_thanyakij_3740766.jpg?w=1200&auto=format%2Ccompress&ogImage=true,"{'logo': 'https://assets.tickertape.in/images/news-publishers/thefreepressjournal.png', 'id': 'www.freepressjournal.in', 'name': 'Free Press Journal'}",[{'sid': 'LICH'}],5f4fe8f00c075a1cc5b971f4
482,"LIC Housing plans to raise Rs 50,500 crore through debt securities",news-article,https://www.financialexpress.com/industry/lic-housing-plans-to-raise-rs-50500-crore-through-debt-securities/2072927/,"In its annual report released on Wednesday, the housing finance company has also warned for a moderation in profitability due to the pandemic.",2020-09-03 00:00:58.000,https://pocket-image-cache.com/direct?url=http://images.financialexpress.com/2020/09/1-74.jpg,"{'logo': 'https://assets.tickertape.in/images/news-publishers/financialexpress.png', 'id': 'www.financialexpress.com', 'name': 'Financial Express'}",[{'sid': 'LICH'}],5f50294d0c075a1cc5b97205
483,"LIC Housing plans to raise Rs 50,500 crore by issuing debt securities",news-article,https://www.business-standard.com/article/companies/lic-housing-plans-to-raise-rs-50-500-crore-by-issuing-debt-securities-120090201020_1.html,The proposal will be taken up at its annual general meeting on September 28 for approval from shareholders,2020-09-02 18:14:00.000,https://pocket-image-cache.com/direct?url=http://bsmedia.business-standard.com/_media/bs/img/article/2020-02/27/full/1582819445-0447.jpg,"{'logo': 'https://assets.tickertape.in/images/news-publishers/businessstandard.png', 'id': 'www.business-standard.com', 'name': 'Business Standard'}",[{'sid': 'LICH'}],5f4f9f240c075a1cc5b97176
484,"LIC Housing Finance to raise ₹50,500 crore",news-article,https://www.thehindubusinessline.com/money-and-banking/lic-housing-finance-to-raise-50500-crore/article32505293.ece,"LIC Housing Finance on Wednesday said it plans to raise as much as ₹50,500 crore by issuing Redeemable Non-Convertible Debentures or other hybrid instruments on a private placement basis.The proposal",2020-09-02 17:35:30.000,https://www.thehindubusinessline.com/money-and-banking/x5qg7u/article32505292.ece/ALTERNATES/LANDSCAPE_615/BL03BPLICHOUSING,"{'logo': 'https://assets.tickertape.in/images/news-publishers/thehindubusinessline.png', 'id': 'www.thehindubusinessline.com', 'name': 'The Hindu Businessline'}",[{'sid': 'LICH'}],5f4f8ec20c075a1cc5b97140
485,"LIC Housing Finance plans to raise Rs 50,500 cr in debt; to seek shareholders’ nod in upcoming AGM",news-article,https://www.financialexpress.com/market/lic-housing-finance-plans-to-raise-rs-50500-cr-in-debt-to-seek-shareholders-nod-in-upcoming-agm/2072757/,"LIC Housing Finance will seek shareholders’ approval in the upcoming annual general meeting this month to raise Rs 50,500 crore.",2020-09-02 17:27:42.000,https://pocket-image-cache.com/direct?url=http://images.financialexpress.com/2020/07/house-rent-small.jpg,"{'logo': 'https://assets.tickertape.in/images/news-publishers/financialexpress.png', 'id': 'www.financialexpress.com', 'name': 'Financial Express'}",[{'sid': 'LICH'}],5f4f87950c075a1cc5b97126
486,"LIC Housing plans to raise Rs 50,500 crore",news-article,https://economictimes.indiatimes.com/markets/stocks/news/lic-housing-plans-to-raise-rs-50500-crore/articleshow/77889742.cms,LIC Housing Finance said its overall borrowing power is of Rs 3 lakh crore and the proposed fund raise plan is within the limit.,2020-09-02 16:39:00.000,"https://pocket-image-cache.com/direct?url=http://img.etimg.com/thumb/msid-77889759,width-1070,height-580,imgsize-154539,overlay-etmarkets/photo.jpg","{'logo': 'https://assets.tickertape.in/images/news-publishers/economictimes.png', 'id': 'economictimes.indiatimes.com', 'name': 'Economic Times'}",[{'sid': 'LICH'}],5f4f80fb0c075a1cc5b97106
487,"LIC Housing Finance plans to raise Rs 50,500 crore",news-article,https://www.moneycontrol.com/news/business/lic-housing-finance-plans-to-raise-rs-50500-crore-5789161.html,"The company’s annual general meeting (AGM) is scheduled to take place through video conference and other audio-visual means on September 28, 2020, in compliance with COVID-19 related regulations.",2020-09-02 16:34:00.000,https://pocket-image-cache.com/direct?url=http://images.moneycontrol.com/static-mcnews/2017/03/rupee-627x435.jpg,"{'logo': 'https://assets.tickertape.in/images/news-publishers/moneycontrol.png', 'id': 'www.moneycontrol.com', 'name': 'Moneycontrol'}",[{'sid': 'LICH'}],5f4f804b0c075a1cc5b97103
488,Financials to rally next? How to allocate your portfolio: Rahul Shah,news-article,https://economictimes.indiatimes.com/markets/expert-view/market-rally-in-financials-next-how-to-allocate-your-portfolio-rahul-shah/articleshow/77843632.cms,"LIC Housing, M&M Finance can do better from the current levels as can smaller banks like RBL or DCB.",2020-08-31 09:58:00.000,"https://pocket-image-cache.com/direct?url=http://img.etimg.com/thumb/msid-77843649,width-1070,height-580,imgsize-152520,overlay-etmarkets/photo.jpg","{'logo': 'https://assets.tickertape.in/images/news-publishers/economictimes.png', 'id': 'economictimes.indiatimes.com', 'name': 'Economic Times'}","[{'sid': 'LICH'}, {'sid': 'MAHM'}]",5f4c72490c075a1cc5b96a87
489,Buy LIC Housing Finance; target of Rs 353: Geojit,news-article,https://www.moneycontrol.com/news/business/stocks/buy-lic-housing-finance-target-of-rs-353-geojit-5767911.html,"Geojit recommended is bullish on LIC Housing Finance has recommended buy rating on the stock with a target price of Rs 353 in its research report dated August 28, 2020.",2020-08-28 16:22:00.000,https://pocket-image-cache.com/direct?url=http://images.moneycontrol.com/static-mcnews/2017/03/buySellHold1-770x433.jpg,"{'logo': 'https://assets.tickertape.in/images/news-publishers/moneycontrol.png', 'id': 'www.moneycontrol.com', 'name': 'Moneycontrol'}",[{'sid': 'LICH'}],5f48e8d50c075a1cc5b96822
490,"LIC Housing Finance Earnings Beat, But Challenges Remain - Investing.com India",news-article,https://in.investing.com/analysis/lic-housing-finance-earnings-beat-but-challenges-remain-200443938,"Read LIC Housing Finance Earnings Beat, But Challenges Remain by Darpin Shah on Investing.com India",2020-08-28 13:34:00.000,https://pocket-image-cache.com/direct?url=http://i-invdn-com.akamaized.net/redesign/images/seo/v2/investingcom_analysis_og.jpg,"{'logo': 'https://assets.tickertape.in/images/news-publishers/investing-com.png', 'id': 'in.investing.com', 'name': 'Investing.com'}",[{'sid': 'LICH'}],5f48bffd0c075a1cc5b9678e
491,Geojit Research: LIC Housing Finance Posts Strong Q1 Performance; Outlook Positive,news-article,https://www.bloombergquint.com/research-reports/geojit-research-lic-housing-finance-posts-strong-q1-performance-outlook-positive,"Expectations of a revival, strong fundamentals and new products will boost LIC Housing Finance’s performance in the near future.",2020-08-28 13:14:06.000,https://pocket-image-cache.com/direct?url=http://gumlet.assettype.com/bloombergquint%2F2020-08%2F1f62c90f-8a41-415a-9efd-6219f534a813%2F357215765.jpg?rect=0%2C223%2C3998%2C2099&w=1200&auto=format%2Ccompress&ogImage=true,"{'logo': 'https://assets.tickertape.in/images/news-publishers/bloombergquint.png', 'id': 'www.bloombergquint.com', 'name': 'Bloomberg Quint'}",[{'sid': 'LICH'}],5f48b8720c075a1cc5b96779
492,Reduce LIC Housing Finance; target of Rs 296: HDFC Securities,news-article,https://www.moneycontrol.com/news/business/stocks/reduce-lic-housing-finance-target-of-rs-296-hdfc-securities-5760931.html,"HDFC Securities recommended reduce rating on LIC Housing Finance with a target price of Rs 296 in its research report dated August 25, 2020.",2020-08-27 14:07:00.000,https://pocket-image-cache.com/direct?url=http://images.moneycontrol.com/static-mcnews/2020/06/reduced-770x433.jpg,"{'logo': 'https://assets.tickertape.in/images/news-publishers/moneycontrol.png', 'id': 'www.moneycontrol.com', 'name': 'Moneycontrol'}","[{'sid': 'HDFC'}, {'sid': 'LICH'}]",5f4774290c075a1cc5b964fa
493,Hold LIC Housing Finance; target of Rs 274: Emkay Global Financial,news-article,https://www.moneycontrol.com/news/business/stocks/hold-lic-housing-finance-target-of-rs-274-emkay-global-financial-5760941.html,"Emkay Global Financial recommended hold rating on LIC Housing Finance with a target price of Rs 274 in its research report dated August 25, 2020.",2020-08-27 14:07:00.000,https://pocket-image-cache.com/direct?url=http://images.moneycontrol.com/static-mcnews/2017/03/hold1-770x433.jpg,"{'logo': 'https://assets.tickertape.in/images/news-publishers/moneycontrol.png', 'id': 'www.moneycontrol.com', 'name': 'Moneycontrol'}","[{'sid': 'EMKS'}, {'sid': 'LICH'}]",5f4774290c075a1cc5b964fb
494,Reduce LIC Housing Finance; target of Rs 282: Prabhudas Lilladher,news-article,https://www.moneycontrol.com/news/business/stocks/reduce-lic-housing-finance-target-of-rs-282-prabhudas-lilladher-5760961.html,"Prabhudas Lilladher recommended reduce rating on LIC Housing Finance with a target price of Rs 282 in its research report dated August 25, 2020.",2020-08-27 14:07:00.000,https://pocket-image-cache.com/direct?url=http://images.moneycontrol.com/static-mcnews/2020/06/reduced-770x433.jpg,"{'logo': 'https://assets.tickertape.in/images/news-publishers/moneycontrol.png', 'id': 'www.moneycontrol.com', 'name': 'Moneycontrol'}",[{'sid': 'LICH'}],5f47742a0c075a1cc5b964fd
495,Buy LIC Housing Finance; target of Rs 345: ICICI Direct,news-article,https://www.moneycontrol.com/news/business/stocks/buy-lic-housing-finance-target-of-rs-345-icici-direct-5760481.html,"ICICI Direct is bullish on LIC Housing Finance recommended buy rating on the stock with a target price of Rs 345 in its research report dated August 26, 2020.",2020-08-26 21:37:00.000,https://pocket-image-cache.com/direct?url=http://images.moneycontrol.com/static-mcnews/2017/03/BUY_Sell_hold1-770x433.jpg,"{'logo': 'https://assets.tickertape.in/images/news-publishers/moneycontrol.png', 'id': 'www.moneycontrol.com', 'name': 'Moneycontrol'}",[{'sid': 'LICH'}],5f468c210c075a1cc5b9638b
496,Buy LIC Housing Finance; target of Rs 345: Sharekhan,news-article,https://www.moneycontrol.com/news/business/stocks/buy-lic-housing-finance-target-of-rs-345-sharekhan-5758661.html,"Sharekhan is bullish on LIC Housing Finance has recommended buy rating on the stock with a target price of Rs 345 in its research report dated August 25, 2020.",2020-08-26 15:23:00.000,https://pocket-image-cache.com/direct?url=http://images.moneycontrol.com/static-mcnews/2017/03/Buy_1-770x433.jpg,"{'logo': 'https://assets.tickertape.in/images/news-publishers/moneycontrol.png', 'id': 'www.moneycontrol.com', 'name': 'Moneycontrol'}",[{'sid': 'LICH'}],5f46398430b1ccf09036b75b
497,Should you buy LIC Housing Finance post Q1 nos? Here’s what analysts say,news-article,https://www.business-standard.com/article/markets/should-you-buy-lic-housing-finance-post-q1-nos-here-s-what-analysts-say-120082600659_1.html,"For the quarter under review, LIC Housing Finances profit before tax (PBT) rose 21 per cent year-on-year (YoY) to Rs 1,017.67 crore.",2020-08-26 12:48:00.000,https://pocket-image-cache.com/direct?url=http://bsmedia.business-standard.com/_media/bs/img/article/2019-10/10/full/1570731290-4145.jpg,"{'logo': 'https://assets.tickertape.in/images/news-publishers/businessstandard.png', 'id': 'www.business-standard.com', 'name': 'Business Standard'}",[{'sid': 'LICH'}],5f46118330b1ccf09036b679
498,"Hold LIC Housing Finance, target price Rs 274: Emkay Global",news-article,https://economictimes.indiatimes.com/markets/stocks/recos/hold-lic-housing-finance-target-price-rs-274-emkay-global/articleshow/77757060.cms,"LIC Housing Finance Ltd., incorporated in the year 1989, is a Large Cap company (having a market cap of Rs 15084.38 Crore) operating in NBFC sector.",2020-08-26 11:20:00.000,"https://pocket-image-cache.com/direct?url=http://img.etimg.com/thumb/msid-77757069,width-1070,height-580,imgsize-531321,overlay-etmarkets/photo.jpg","{'logo': 'https://assets.tickertape.in/images/news-publishers/economictimes.png', 'id': 'economictimes.indiatimes.com', 'name': 'Economic Times'}","[{'sid': 'EMKS'}, {'sid': 'LICH'}]",5f45f9bfe94a91abb8bb1af6
499,LIC Housing Finance shows resilience amid crisis; bad loan stress remains,news-article,https://www.livemint.com/market/mark-to-market/lic-housing-finance-shows-resilience-amid-pandemic-but-bad-loan-worry-remains-11598352983770.html,"Nearly 25% of the lender’s loan book is under moratorium, higher than 22.4% of industry leader HDFC",2020-08-25 22:03:22.000,https://pocket-image-cache.com/direct?url=http://images.livemint.com/img/2020/08/25/600x338/b4818f96-937a-11e9-932b-3578ec0f3acf_1561051668510_1598354153158.jpg,"{'logo': 'https://assets.tickertape.in/images/news-publishers/livemint.png', 'id': 'www.livemint.com', 'name': 'Livemint'}","[{'sid': 'HDFC'}, {'sid': 'LICH'}]",5f44fac0e94a91abb8bb1954
500,LIC Housing Finance rallies 11% after strong Q1 performance,news-article,https://www.livemint.com/market/stock-market-news/lic-housing-finance-rallies-11-after-strong-q1-performance-11598348069071.html,"Total disbursements were at ₹3,560 crore in the first quarter compared with ₹10,261 crore in the corresponding period a year ago. Of this, disbursement in individual home loan segment was at ₹3,034 crore as against ₹7,871 crore",2020-08-25 15:18:16.000,https://pocket-image-cache.com/direct?url=http://images.livemint.com/img/2020/08/25/600x338/stock-kpeE--621x414@LiveMint_1598348855660.jpg,"{'logo': 'https://assets.tickertape.in/images/news-publishers/livemint.png', 'id': 'www.livemint.com', 'name': 'Livemint'}",[{'sid': 'LICH'}],5f44e5a9e94a91abb8bb1900
501,LIC Housing Finance share jumps over 11% post Q1 earnings,news-article,https://www.businesstoday.in/markets/company-stock/lic-housing-finance-share-jumps-over-11-post-q1-earnings/story/414038.html,"LIC Housing Finance stock has risen 10.42% in one week and 8.6% in the last one month. Market capitalisation of the firm stood at Rs 14,943 crore as of today’s session",2020-08-25 15:13:00.000,https://pocket-image-cache.com/direct?url=http://akm-img-a-in.tosshub.com/sites/btmt/images/stories/ticker_505_250820031026.jpg,"{'logo': 'https://assets.tickertape.in/images/news-publishers/businesstoday.png', 'id': 'www.businesstoday.in', 'name': 'Business Today'}",[{'sid': 'LICH'}],5f44dfe7e94a91abb8bb18f4
502,LIC Housing shares jump nearly 12% after Q1 results,news-article,https://economictimes.indiatimes.com/markets/stocks/news/lic-housing-shares-jump-nearly-12-after-q1-results/articleshow/77737527.cms,The company’s profit after tax stood at Rs 610.68 crore in the April-June quarter of the previous fiscal.,2020-08-25 13:09:00.000,"https://pocket-image-cache.com/direct?url=http://img.etimg.com/thumb/msid-77737565,width-1070,height-580,imgsize-345335,overlay-etmarkets/photo.jpg","{'logo': 'https://assets.tickertape.in/images/news-publishers/economictimes.png', 'id': 'economictimes.indiatimes.com', 'name': 'Economic Times'}",[{'sid': 'LICH'}],5f44cb59e94a91abb8bb18a7
503,LIC Housing Finance rallies nearly 12% on robust earnings,news-article,https://www.livemint.com/market/stock-market-news/lic-housing-rallies-nearly-12-on-robust-earnings-11598337450779.html,"On the BSE, the LICHFL stock surges 11.45% to Rs308.40 and on the NSE it rises 11.71% to Rs309",2020-08-25 12:57:26.000,https://pocket-image-cache.com/direct?url=http://images.livemint.com/img/2020/08/25/600x338/rupee5-k6gD--621x414@LiveMint_1598337774791.jpg,"{'logo': 'https://assets.tickertape.in/images/news-publishers/livemint.png', 'id': 'www.livemint.com', 'name': 'Livemint'}","[{'sid': 'BSEL'}, {'sid': 'LICH'}]",5f44c280e94a91abb8bb187b
504,Allcargo Logistics Ltd leads gainers in ‘A’ group,news-article,https://www.business-standard.com/article/news-cm/allcargo-logistics-ltd-leads-gainers-in-a-group-120082500591_1.html,"Max Financial Services Ltd, Dish TV India Ltd, Timken India Ltd and LIC Housing Finance Ltd are among the other gainers in the BSEs A group today, 25 August 2020.",2020-08-25 12:31:11.000,https://assets.tickertape.in/images/news-publishers/businessstandard.png,"{'logo': 'https://assets.tickertape.in/images/news-publishers/businessstandard.png', 'id': 'www.business-standard.com', 'name': 'Business Standard'}","[{'sid': 'ACLL'}, {'sid': 'DSTV'}, {'sid': 'LICH'}, {'sid': 'MAXI'}, {'sid': 'TIMK'}]",5f44b8bbe94a91abb8bb185e
505,Healthy Q1 earnings drive LIC Housing on D-Street; Stock jumps over 11%,news-article,https://www.indiainfoline.com/article/news-sector-banking-financials/healthy-q1-earnings-drive-lic-housing-on-d-street-stock-jumps-over-11-120082500537_1.html,LIC Housing witnessed a 34% rise in net profit to Rs817.48cr compared to a profit of Rs610.68cr a year ago in the same period.,2020-08-25 11:34:00.000,https://pocket-image-cache.com/direct?url=http://content.indiainfoline.com/_media/iifl/img/article/2019-04/12/full/1555059204-9844.jpg,"{'logo': 'https://assets.tickertape.in/images/news-publishers/iifl.png', 'id': 'www.indiainfoline.com', 'name': 'India Infoline'}",[{'sid': 'LICH'}],5f44adcce94a91abb8bb1831
506,LIC Housing Finance share price surges over 11% on 34% rise in net profit in Apr-Jun quarter,news-article,https://www.financialexpress.com/market/lic-housing-finance-share-price-surges-over-11-on-34-rise-in-net-profit-in-apr-jun-quarter/2064562/,"With today’s gain in the stock price, LIC Housing Finance shares have rallied 66 per cent from March lows of Rs 186 apiece.",2020-08-25 10:52:13.000,https://pocket-image-cache.com/direct?url=http://images.financialexpress.com/2020/08/1-843.jpg,"{'logo': 'https://assets.tickertape.in/images/news-publishers/financialexpress.png', 'id': 'www.financialexpress.com', 'name': 'Financial Express'}",[{'sid': 'LICH'}],5f44a0c4e94a91abb8bb1808
507,LIC Housing shares jump 9% after June quarter profit rises 34% to Rs 817 crore,news-article,https://www.moneycontrol.com/news/business/stocks/lic-housing-shares-jump-9-after-june-quarter-profit-rises-34-to-rs-817-crore-5751651.html,"Total income of the company rose to Rs 4,977.49 crore in April-June 2020 from Rs 4,807.21 crore in the year-ago quarter, according to regulatory filing.",2020-08-25 09:50:00.000,https://pocket-image-cache.com/direct?url=http://images.moneycontrol.com/static-mcnews/2019/05/DDA-Housing-770x433.jpg,"{'logo': 'https://assets.tickertape.in/images/news-publishers/moneycontrol.png', 'id': 'www.moneycontrol.com', 'name': 'Moneycontrol'}",[{'sid': 'LICH'}],5f4494a9e94a91abb8bb17d5
508,LIC Housing Finance surges 11% as net profit in June quarter rises 35% YoY,news-article,https://www.business-standard.com/article/markets/lic-housing-finance-surges-11-as-net-profit-in-june-quarter-rises-35-yoy-120082500267_1.html,"Its profit before tax (PBT) rose 21 per cent year-on-year (YoY) to Rs 1,017.67 crore.",2020-08-25 09:48:00.000,https://pocket-image-cache.com/direct?url=http://bsmedia.business-standard.com/_media/bs/img/article/2020-06/18/full/1592431517-653.jpg,"{'logo': 'https://assets.tickertape.in/images/news-publishers/businessstandard.png', 'id': 'www.business-standard.com', 'name': 'Business Standard'}",[{'sid': 'LICH'}],5f4495dce94a91abb8bb17dd
509,LIC Housing in focus: Q1 PAT rises by 34% yoy to Rs817cr on lower provisions,news-article,https://www.indiainfoline.com/article/news-sector-banking-financials/lic-housing-in-focus-q1-pat-rises-by-34-yoy-to-rs817cr-on-lower-provisions-120082500423_1.html,"The company registered a provision of Rs56cr in the quarter, which slumped massively against Rs253cr of June 2020.",2020-08-25 09:14:00.000,https://pocket-image-cache.com/direct?url=http://content.indiainfoline.com/_media/iifl/img/misc/2015-03/10/full/lic2-1425981585-1038300.jpg,"{'logo': 'https://assets.tickertape.in/images/news-publishers/iifl.png', 'id': 'www.indiainfoline.com', 'name': 'India Infoline'}",[{'sid': 'LICH'}],5f448aa3e94a91abb8bb17ae
510,LIC Housing Finance standalone net profit rises 33.86% in the June 2020 quarter,news-article,https://www.business-standard.com/article/news-cm/lic-housing-finance-standalone-net-profit-rises-33-86-in-the-june-2020-quarter-120082500221_1.html,Sales rise 4.09% to Rs 5003.71 crore,2020-08-25 09:04:00.000,https://assets.tickertape.in/images/news-publishers/businessstandard.png,"{'logo': 'https://assets.tickertape.in/images/news-publishers/businessstandard.png', 'id': 'www.business-standard.com', 'name': 'Business Standard'}",[{'sid': 'LICH'}],5f448e84e94a91abb8bb17bf
511,"Stocks in focus: Axis Bank, Bharti Airtel, Future Retail, ICICI Bank, IRCON, LIC Housing Finance",news-article,https://www.financialexpress.com/market/axis-bank-bharti-airtel-future-retail-icici-bank-ircon-lic-housing-finance-pnb-sbi-ircon-international-stocks-in-focus/2064467/,"A total of 76 companies including Atul Auto, Can Fin Homes, IRCON International, Kirloskar Electric Company, Phillips Carbon Black, Ruchira Papers, Hindustan Hardy Spicer, are scheduled to announce their quarterly earning earnings today.",2020-08-25 08:53:57.000,https://pocket-image-cache.com/direct?url=http://images.financialexpress.com/2020/08/bullmarket1-1.jpg,"{'logo': 'https://assets.tickertape.in/images/news-publishers/financialexpress.png', 'id': 'www.financialexpress.com', 'name': 'Financial Express'}","[{'sid': 'ATUL'}, {'sid': 'AXBK'}, {'sid': 'BRTI'}, {'sid': 'CNFH'}, {'sid': 'FRTL'}, {'sid': 'ICBK'}, {'sid': 'KREL'}, {'sid': 'LICH'}, {'sid': 'PHIL'}, {'sid': 'RCHR'}, {'sid': 'IRCN'}]",5f4484a5e94a91abb8bb17a3
512,"Stocks to watch: Telcos, Axis Bank, LIC Housing Finance, IRB Infra, IBHFL",news-article,https://www.business-standard.com/article/markets/stocks-to-watch-telcos-axis-bank-lic-housing-finance-irb-infra-ibhfl-120082500182_1.html,Heres a list of stocks that may trade actively in todays session,2020-08-25 08:44:00.000,https://pocket-image-cache.com/direct?url=http://bsmedia.business-standard.com/_media/bs/img/article/2020-07/28/full/1595960385-5396.jpg,"{'logo': 'https://assets.tickertape.in/images/news-publishers/businessstandard.png', 'id': 'www.business-standard.com', 'name': 'Business Standard'}","[{'sid': 'AXBK'}, {'sid': 'IRBI'}, {'sid': 'LICH'}]",5f44870ee94a91abb8bb17a9
513,LIC Housing Finance consolidated net profit rises 35.34% in the June 2020 quarter,news-article,https://www.business-standard.com/article/news-cm/lic-housing-finance-consolidated-net-profit-rises-35-34-in-the-june-2020-quarter-120082500196_1.html,Sales rise 4.07% to Rs 5011.50 crore,2020-08-25 07:52:00.000,https://assets.tickertape.in/images/news-publishers/businessstandard.png,"{'logo': 'https://assets.tickertape.in/images/news-publishers/businessstandard.png', 'id': 'www.business-standard.com', 'name': 'Business Standard'}",[{'sid': 'LICH'}],5f448e8ce94a91abb8bb17c5
