,title,feed_type,link,description,date,image,publisher,stocks,_id
168,Stocks that will see action today (May 18),news-article,https://www.thehindubusinessline.com/markets/stocks-that-will-see-action-today-may-18/article65425251.ece,"Buzzing stocks: ITC, Lupin, Motilal Oswal, TVS Motor, LIC Housing, GIC HF, Route Mobile, IOB, Zydus Life, Ashoka Buildcon, Ramco Industries, Manappuram Fin, Interglobe Aviation",2022-05-18 08:58:54.000,https://www.thehindubusinessline.com/incoming/2zrq8/article65422701.ece/alternates/LANDSCAPE_615/IMG_PO10_markets_4_1_0H9MJ311.jpg,"{'logo': 'https://assets.tickertape.in/images/news-publishers/thehindubusinessline.png', 'id': 'www.thehindubusinessline.com', 'name': 'The Hindu Businessline'}","[{'sid': 'ABDL'}, {'sid': 'GENA'}, {'sid': 'INGL'}, {'sid': 'ITC'}, {'sid': 'LICH'}, {'sid': 'LUPN'}, {'sid': 'MNFL'}, {'sid': 'MOFS'}, {'sid': 'RAMC'}, {'sid': 'ROUT'}, {'sid': 'TVSM'}]",628469b93daa4a93e5bc800e
169,LIC Housing Finance raises home loan interest rate by 20 bps for select borrowers,news-article,https://www.thehindu.com/business/lic-housing-finance-raises-home-loan-interest-rate-by-20-bps-for-select-borrowers/article65411929.ece,Mumbai,2022-05-13 22:03:50.000,https://www.thehindu.com/theme/images/og-image.png,"{'logo': 'https://assets.tickertape.in/images/news-publishers/thehindu.png', 'id': 'www.thehindu.com', 'name': 'The Hindu'}",[{'sid': 'LICH'}],627e0c3b0fdeb80a09fe54c9
170,LIC Housing Finance increases home loan rates; check details,news-article,https://www.businesstoday.in/latest/economy/story/lic-housing-finance-increases-home-loan-rates-check-details-333440-2022-05-13?utm_source=rssfeed,"Strap: The new interest rates on home loans start from 6.9 per cent, up from the previous 6.7 per cent. The latest rates are effective from May 13.",2022-05-13 17:30:00.000,https://pocket-image-cache.com/direct?url=http://akm-img-a-in.tosshub.com/businesstoday/images/story/202205/buildings-real-estate_1200-sixteen_nine.jpg,"{'logo': 'https://assets.tickertape.in/images/news-publishers/businesstoday.png', 'id': 'www.businesstoday.in', 'name': 'Business Today'}",[{'sid': 'LICH'}],627e01600fdeb80a09fe546f
171,LIC Housing Finance ups minimum interest rate to 6.90%,news-article,https://www.thehindubusinessline.com/money-and-banking/lic-housing-fin-ups-minimum-home-loan-rate-to-690-per-cent/article65409888.ece,This revision in home loan rate comes in the wake of the RBI increasing the repo rate by 40 basis points,2022-05-13 16:14:57.000,https://www.thehindubusinessline.com/news/wrrxc5/article65410420.ece/alternates/LANDSCAPE_615/PO11Home.jpg,"{'logo': 'https://assets.tickertape.in/images/news-publishers/thehindubusinessline.png', 'id': 'www.thehindubusinessline.com', 'name': 'The Hindu Businessline'}",[{'sid': 'LICH'}],627e02fb0fdeb80a09fe547a
172,LIC Housing Finance increases home loan rate to 6.9% for select borrowers,news-article,https://www.business-standard.com/article/companies/lic-housing-finance-increases-home-loan-rate-to-6-9-for-select-borrowers-122051300492_1.html,"For borrowers with CIBIL score of 700 and above, the rate hike has been limited to only 20 bps, LIC Housing Finance said in a statement, adding that the revised rates are applicable from Friday",2022-05-13 13:43:00.000,https://pocket-image-cache.com/direct?url=http://bsmedia.business-standard.com/_media/bs/img/article/2022-02/14/full/1644779838-3254.jpg,"{'logo': 'https://assets.tickertape.in/images/news-publishers/businessstandard.png', 'id': 'www.business-standard.com', 'name': 'Business Standard'}",[{'sid': 'LICH'}],627e16d90fdeb80a09fe5547
173,LIC Housing Finance raises home loan interest rate by 20 basis points for select borrowers,news-article,https://www.thehindu.com/business/lic-housing-finance-raises-home-loan-interest-rate-by-20-basis-points-for-select-borrowers/article65410056.ece,"“For borrowers with CIBIL score of 700 and above, the rate hike has been limited to only 20 bps,” LIC Housing Finance said in a statement",2022-05-13 13:08:30.000,https://www.thehindu.com/incoming/gujxbz/article65410096.ece/alternates/LANDSCAPE_615/Capture.PNG,"{'logo': 'https://assets.tickertape.in/images/news-publishers/thehindu.png', 'id': 'www.thehindu.com', 'name': 'The Hindu'}",[{'sid': 'LICH'}],627e0cd20fdeb80a09fe54d5
174,LIC Housing Finance ups home loan interest rate by 20 bps for select borrowers,news-article,https://www.moneycontrol.com/news/business/lic-housing-finance-ups-home-loan-interest-rate-by-20-bps-for-select-borrowers-8501871.html,"For borrowers with CIBIL score of 700 and above, the rate hike has been limited to only 20 bps, LIC Housing Finance said in a statement, adding that the revised rates are applicable from Friday.",2022-05-13 12:49:44.000,https://pocket-image-cache.com/direct?url=http://images.moneycontrol.com/static-mcnews/2021/08/interest-rates_shutterstock_254985844-770x433.jpg,"{'logo': 'https://assets.tickertape.in/images/news-publishers/moneycontrol.png', 'id': 'www.moneycontrol.com', 'name': 'Moneycontrol'}",[{'sid': 'LICH'}],627e0d0f0fdeb80a09fe54da
175,IPO-bound LIC plans to cross-sell policies via housing finance arm,news-article,https://www.business-standard.com/article/companies/ipo-bound-lic-plans-to-cross-sell-policies-via-housing-finance-arm-122041300063_1.html,This would be by selling insurance products to home buyers who avail loans from LIC Housing Finance,2022-04-13 06:05:00.000,https://pocket-image-cache.com/direct?url=http://bsmedia.business-standard.com/_media/bs/img/article/2022-04/13/full/1649793239-6762.jpg,"{'logo': 'https://assets.tickertape.in/images/news-publishers/businessstandard.png', 'id': 'www.business-standard.com', 'name': 'Business Standard'}",[{'sid': 'LICH'}],625624b202cffc773545c455
176,"NBFC recovery to bring higher Q4 profits; funding costs to rise, too",news-article,https://economictimes.indiatimes.com/industry/banking/finance/banking/nbfc-recovery-to-bring-higher-q4-profits-funding-costs-to-rise-too/articleshow/90786890.cms,"Motilal Oswal expects NBFCs under its coverage to report a year-on-year net profit growth of 32% led by Bajaj Finance, Cholamandalam Investment and Finance, L&T Finance and LIC Housing Finance (LICHF). It expects higher credit costs to hurt Mahindra & Mahindra Financial Services, which could impact …",2022-04-12 06:42:00.000,"https://pocket-image-cache.com/direct?url=http://img.etimg.com/thumb/msid-90786892,width-1070,height-580,imgsize-58032,overlay-economictimes/photo.jpg","{'logo': 'https://assets.tickertape.in/images/news-publishers/economictimes.png', 'id': 'economictimes.indiatimes.com', 'name': 'Economic Times'}","[{'sid': 'BJFN'}, {'sid': 'CHLA'}, {'sid': 'MMFS'}, {'sid': 'LICH'}, {'sid': 'LTFH'}, {'sid': 'MOFS'}]",6254a2c702cffc773545b92b
177,Trade setup for today: Top 15 things to know before the opening bell,news-article,https://www.moneycontrol.com/news/business/markets/trade-setup-for-monday-top-15-things-to-know-before-opening-bell-177-8309571.html,"Based on the open interest future percentage, here are the 98 stocks including Power Grid Corporation of India, Bata India, Vodafone Idea, Bharat Electronics, and LIC Housing Finance, in which a long build-up was seen.",2022-04-03 19:55:43.000,https://pocket-image-cache.com/direct?url=http://images.moneycontrol.com/static-mcnews/2022/03/sensex_nifty-marketup_sensexup-Niftyup-4-770x433.jpg,"{'logo': 'https://assets.tickertape.in/images/news-publishers/moneycontrol.png', 'id': 'www.moneycontrol.com', 'name': 'Moneycontrol'}","[{'sid': 'BATA'}, {'sid': 'BAJE'}, {'sid': 'VODA'}, {'sid': 'LICH'}, {'sid': 'PGRD'}]",6249eaa406b6807aa5037c5d
178,F&O Strategy: Consider bull-call spread on LIC Housing Finance,news-article,https://www.thehindubusinessline.com/portfolio/commodity-analysis/fo-strategy-consider-bull-call-spread-on-lic-housing-finance/article65284190.ece,Strong rollover to April series indicates positive bias,2022-04-02 18:57:29.000,https://www.thehindubusinessline.com/portfolio/cs7ssa/article65284236.ece/alternates/LANDSCAPE_615/LIC%20Housing%20Finance,"{'logo': 'https://assets.tickertape.in/images/news-publishers/thehindubusinessline.png', 'id': 'www.thehindubusinessline.com', 'name': 'The Hindu Businessline'}",[{'sid': 'LICH'}],624854a747ec906f06a43cc0
179,Tech Query: What is the outlook for LIC Housing Finance?,news-article,https://www.thehindubusinessline.com/portfolio/technical-analysis/tech-query-what-is-the-outlook-for-lic-housing-finance/article65259571.ece,The stock can move either up to ₹450-₹480 or fall to ₹290 and even ₹220-₹200 from current levels,2022-03-26 20:14:30.000,https://www.thehindubusinessline.com/incoming/7lbgx9/article65262307.ece/alternates/LANDSCAPE_615/PO27_Stockmarket_3.jpg,"{'logo': 'https://assets.tickertape.in/images/news-publishers/thehindubusinessline.png', 'id': 'www.thehindubusinessline.com', 'name': 'The Hindu Businessline'}",[{'sid': 'LICH'}],623f2f36bcb9019ac107d434
180,HDFC AMC to LIC Housing: These stocks bleed up to 42% from their 52-week highs,news-article,https://www.livemint.com/market/stock-market-news/hdfc-amc-irctc-sail-to-lic-housing-these-stocks-bleed-up-to-42-from-their-52-week-highs-11648005343044.html,"Stocks like HDFC Asset Management Company, IRCTC, SAIL and LIC Housing Finance have been under selloff heat after climbing to a new 52-week peak",2022-03-23 08:54:34.000,https://pocket-image-cache.com/direct?url=http://images.livemint.com/img/2022/03/23/600x338/415be322-4602-11eb-bc1d-4bfe13e32b0e_1608858841050_1608858879986_1648005539317.jpg,"{'logo': 'https://assets.tickertape.in/images/news-publishers/livemint.png', 'id': 'www.livemint.com', 'name': 'Livemint'}","[{'sid': 'HDFA'}, {'sid': 'INIR'}, {'sid': 'LICH'}]",623a9ad1bcb9019ac107b679
181,"Taking Stock | Geopolitical tension roils market, indices see biggest single-day fall in nearly two years",news-article,https://www.moneycontrol.com/news/business/markets/taking-stock-geopolitical-tension-roils-market-indices-see-biggest-single-day-fall-in-nearly-two-years-8159581.html,"More than 250 stocks touched their 52-week low, including Star Cement, SMS Pharmaceuticals, NBCC, LIC Housing Finance, HDFC Life Insurance Company and DCB Bank.",2022-03-07 17:30:00.000,https://pocket-image-cache.com/direct?url=http://images.moneycontrol.com/static-mcnews/2022/02/sensexdown_niftydown-2-770x433.jpg,"{'logo': 'https://assets.tickertape.in/images/news-publishers/moneycontrol.png', 'id': 'www.moneycontrol.com', 'name': 'Moneycontrol'}","[{'sid': 'DCBA'}, {'sid': 'HDFL'}, {'sid': 'LICH'}, {'sid': 'NBCC'}, {'sid': 'SMSP'}, {'sid': 'STAT'}]",62176fdf75a0b7489014d598
182,"LIC Housing Finance to Offer Home Loans Starting at 6.7% via CSE. Know Details, How to Apply",news-article,https://www.news18.com/news/business/lic-housing-finance-to-offer-home-loans-starting-at-6-7-via-cse-know-details-how-to-apply-4827881.html,"To avail of the loan facility, interested customers can directly approach the CSC and submit their application with KYC documents",2022-03-03 16:17:09.000,https://pocket-image-cache.com/direct?url=http://images.news18.com/ibnlive/uploads/2021/11/rupees-1-163740711716x9.png,"{'logo': 'https://assets.tickertape.in/images/news-publishers/news18.png', 'id': 'www.news18.com', 'name': 'News18'}",[{'sid': 'LICH'}],6220a188b910eb164a835719
183,"ICICI Bank, ITC, KNR Constructions ‘top picks’ for Centrum Broking",news-article,https://www.business-standard.com/article/markets/icici-bank-itc-knr-constructions-top-picks-for-centrum-broking-122022301277_1.html,"ICICI Bank, LIC Housing Finance, UTI Asset Management Company, and Care Ratings shares are brokerage house Centrum Broking’s ‘top picks’ for the current quarter.",2022-02-23 20:32:00.000,https://pocket-image-cache.com/direct?url=http://bsmedia.business-standard.com/_media/bs/img/article/2021-01/29/full/1611888828-5134.jpg,"{'logo': 'https://assets.tickertape.in/images/news-publishers/businessstandard.png', 'id': 'www.business-standard.com', 'name': 'Business Standard'}","[{'sid': 'CREI'}, {'sid': 'ICBK'}, {'sid': 'ITC'}, {'sid': 'KNRL'}, {'sid': 'LICH'}, {'sid': 'UTI'}]",62164f5675a0b7489014ce4f
184,LIC Housing | IDBI Bank: LIC could make IDBI Bank agent for LIC Housing,news-article,https://economictimes.indiatimes.com/markets/ipos/fpos/lic-mulls-idbi-lic-housing-relationship-hopes-to-list-before-march-end/articleshow/89728379.cms,"LIC bought a 51 per cent stake in IDBI in January 2019, by purchasing 82.75 crore shares from the government.",2022-02-22 05:57:00.000,"https://pocket-image-cache.com/direct?url=http://img.etimg.com/thumb/msid-89728357,width-1070,height-580,imgsize-70370,overlay-etmarkets/photo.jpg","{'logo': 'https://assets.tickertape.in/images/news-publishers/economictimes.png', 'id': 'economictimes.indiatimes.com', 'name': 'Economic Times'}","[{'sid': 'IDBI'}, {'sid': 'LICH'}]",621392c675a0b7489014bb20
185,LIC Housing To PNB Housing: Credit Suisse Sees ‘Uneven’ Growth Recovery For NBFCs,news-article,https://www.bloombergquint.com/business/lic-housing-to-pnb-housing-credit-suisse-sees-uneven-growth-recovery-for-nbfcs,Here are the top NBFC picks for Credit Suisse and the stocks it’s cautious on...,2022-02-18 13:57:33.000,https://pocket-image-cache.com/direct?url=http://gumlet.assettype.com/bloombergquint%2F2022-02%2Feaded36c-5426-4dee-8f6a-44e6c7079b28%2FA_man_counts_Indian_rupee_banknotes_in_an_arranged_photograph_in_Varanasi__Uttar_Pradesh__India__Pho.jpg?rect=0%2C349%2C3998%2C2099&w=1200&auto=format%2Ccompress&ogImage=true,"{'logo': 'https://assets.tickertape.in/images/news-publishers/bloombergquint.png', 'id': 'www.bloombergquint.com', 'name': 'Bloomberg Quint'}","[{'sid': 'LICH'}, {'sid': 'PNBH'}]",620f5389c0440bee47f6ad4a
186,LIC Housing or IDBI has to stop home loan biz by November next year,news-article,https://www.business-standard.com/article/companies/lic-housing-or-idbi-has-to-stop-home-loan-biz-by-november-next-year-122021400026_1.html,"Housing finance will be conducted only by one entity, the insurer said, in the draft red herring prospectus (DRHP) for its initial public offering (IPO).",2022-02-14 06:12:00.000,https://pocket-image-cache.com/direct?url=http://bsmedia.business-standard.com/_media/bs/img/article/2022-02/14/full/1644779838-3254.jpg,"{'logo': 'https://assets.tickertape.in/images/news-publishers/businessstandard.png', 'id': 'www.business-standard.com', 'name': 'Business Standard'}","[{'sid': 'IDBI'}, {'sid': 'LICH'}]",6209ad97c0440bee47f682bf
187,Real estate developer Sushma group raises Rs 100 crore,news-article,https://economictimes.indiatimes.com/industry/services/property-/-cstruction/real-estate-developer-sushma-group-raises-rs-100-crore/articleshow/89527019.cms,The fund will also be used to give exit to existing lender LIC housing and remaining will be used to complete the construction of project.,2022-02-12 17:07:00.000,"https://pocket-image-cache.com/direct?url=http://img.etimg.com/thumb/msid-89527054,width-1070,height-580,imgsize-45750,overlay-economictimes/photo.jpg","{'logo': 'https://assets.tickertape.in/images/news-publishers/economictimes.png', 'id': 'economictimes.indiatimes.com', 'name': 'Economic Times'}",[{'sid': 'LICH'}],6207a6ff92b3ff99837dbf3d
188,Nandish Shah recommends a Bull spread strategy on LIC Housing Finance,news-article,https://www.business-standard.com/article/markets/nandish-shah-recommends-a-bull-spread-strategy-on-lic-housing-finance-122021100176_1.html,The derivative analyst from HDFC Securities recommends buying Buy LICHSG FINANCE FEB 410 CALL and simultaneously selling 430 CALL,2022-02-11 08:21:00.000,https://pocket-image-cache.com/direct?url=http://bsmedia.business-standard.com/_media/bs/img/article/2021-08/03/full/1627995142-7402.jpg,"{'logo': 'https://assets.tickertape.in/images/news-publishers/businessstandard.png', 'id': 'www.business-standard.com', 'name': 'Business Standard'}","[{'sid': 'HDFC'}, {'sid': 'LICH'}]",6205d53292b3ff99837db153
189,"Trade Spotlight | What You Should Do With LIC Housing Finance, Laurus Labs, Coforge, Can Fin Homes, Bata India",news-article,https://www.moneycontrol.com/news/business/markets/trade-spotlight-what-you-should-do-with-lic-housing-finance-laurus-labs-coforge-can-fin-homes-bata-india-8005091.html,Here’s what Jayesh Bhanushali of IIFL Securities recommends investors should do with these stocks when the market resumes trading today,2022-01-31 07:15:17.000,https://pocket-image-cache.com/direct?url=http://images.moneycontrol.com/static-mcnews/2022/01/nifty_market-Sensex-770x433.jpg,"{'logo': 'https://assets.tickertape.in/images/news-publishers/moneycontrol.png', 'id': 'www.moneycontrol.com', 'name': 'Moneycontrol'}","[{'sid': 'BATA'}, {'sid': 'CNFH'}, {'sid': 'IIFS'}, {'sid': 'LAUL'}, {'sid': 'LICH'}]",61f74585bff0793a6c09704c
190,"LIC Housing Shares Gain Most In 21 Months On Profit Beat, Better NIM: Brokerages’ Take",news-article,https://www.bloombergquint.com/business/lic-housing-shares-gain-most-in-a-year-on-profit-beat-better-nim-brokerages-take,Here’s what brokerages made of LIC Housing Finance’s Q3 FY22 results...,2022-01-28 16:40:51.000,https://pocket-image-cache.com/direct?url=http://gumlet.assettype.com/bloombergquint%2F2019-05%2F612f3263-ad5d-4347-9d52-7fbfc07bf472%2F314200808_1_7.jpg?rect=0%2C0%2C4000%2C2100&w=1200&auto=format%2Ccompress&ogImage=true,"{'logo': 'https://assets.tickertape.in/images/news-publishers/bloombergquint.png', 'id': 'www.bloombergquint.com', 'name': 'Bloomberg Quint'}",[{'sid': 'LICH'}],61f380e413361b4f7c0d39e8
191,LIC Housing Finance shares jump nearly 13% as firm sees 6% rise in profit,news-article,https://www.business-standard.com/article/markets/lic-housing-finance-shares-jump-nearly-13-as-firm-sees-6-rise-in-profit-122012800365_1.html,Shares of LIC Housing Finance (LICHFL) on Friday zoomed nearly 13 per cent after the firm reported a 6 per cent increase in profit after tax for the quarter ended December 2021.,2022-01-28 14:18:00.000,https://pocket-image-cache.com/direct?url=http://bsmedia.business-standard.com/_media/bs/img/article/2013-06/21/full/1371790982-453.jpg,"{'logo': 'https://assets.tickertape.in/images/news-publishers/businessstandard.png', 'id': 'www.business-standard.com', 'name': 'Business Standard'}",[{'sid': 'LICH'}],61f3b3e913361b4f7c0d3c81
192,LIC Housing Finance Ltd leads gainers in ‘A’ group,news-article,https://www.business-standard.com/article/news-cm/lic-housing-finance-ltd-leads-gainers-in-a-group-122012800481_1.html,"JSW Holdings Ltd, Kirloskar Ferrous Industries Ltd, Can Fin Homes Ltd and Gujarat Mineral Development Corporation Ltd are among the other gainers in the BSE’s ‘A’ group today, 28 January 2022.",2022-01-28 12:04:05.000,https://assets.tickertape.in/images/news-publishers/businessstandard.png,"{'logo': 'https://assets.tickertape.in/images/news-publishers/businessstandard.png', 'id': 'www.business-standard.com', 'name': 'Business Standard'}","[{'sid': 'CNFH'}, {'sid': 'BSEL'}, {'sid': 'GMDC'}, {'sid': 'JNSW'}, {'sid': 'KRFI'}, {'sid': 'LICH'}]",61f3913113361b4f7c0d3ac4
193,LIC Housing spurts after Q3 PAT rises 6% YoY to Rs Rs 770 cr,news-article,https://www.business-standard.com/article/news-cm/lic-housing-spurts-after-q3-pat-rises-6-yoy-to-rs-rs-770-cr-122012800507_1.html,"LIC Housing Finance rose 14.13% to Rs 394.15 after the company’s consolidated net profit rose 6.82% to Rs 770.24 crore on a 3.09% increase in total income to Rs 5,078.68 crore in Q3 December 2021 over Q3 December 2020.",2022-01-28 12:02:00.000,https://assets.tickertape.in/images/news-publishers/businessstandard.png,"{'logo': 'https://assets.tickertape.in/images/news-publishers/businessstandard.png', 'id': 'www.business-standard.com', 'name': 'Business Standard'}",[{'sid': 'LICH'}],61f3984013361b4f7c0d3b30
194,LIC Housing Finance shares up nearly 13% after firm posts 6% increase in PAT during April-September,news-article,https://www.freepressjournal.in/business/lic-housing-finance-shares-up-nearly-13-after-firm-posts-6-increase-in-pat-during-april-september,LIC Housing Finance shares up nearly 13% after firm posts 6% increase in PAT during April-September,2022-01-28 11:58:04.000,https://pocket-image-cache.com/direct?url=http://images.assettype.com/freepressjournal/2021-07/2f23eebc-7c6f-401b-b37e-c662629adddb/lic_hf.png?rect=0%2C0%2C3900%2C2048&w=1200&auto=format%2Ccompress&ogImage=true,"{'logo': 'https://assets.tickertape.in/images/news-publishers/thefreepressjournal.png', 'id': 'www.freepressjournal.in', 'name': 'Free Press Journal'}",[{'sid': 'LICH'}],61f38d3713361b4f7c0d3a9e
195,LIC Housing Finance share surges 14% on strong Q3 earnings. Should you buy?,news-article,https://www.livemint.com/market/stock-market-news/lic-housing-finance-share-surges-14-on-strong-q3-earnings-should-you-buy-11643350004069.html,"On account of rise in loan order book and decline in provisioning, LIC Housing Finance has reported strong Q3 earnings",2022-01-28 11:46:43.000,https://pocket-image-cache.com/direct?url=http://images.livemint.com/img/2022/01/28/600x338/licfl_1605096188482_1605096387798_1643350140916.jpg,"{'logo': 'https://assets.tickertape.in/images/news-publishers/livemint.png', 'id': 'www.livemint.com', 'name': 'Livemint'}",[{'sid': 'LICH'}],61f38ce113361b4f7c0d3a9a
196,LIC Housing Finance Share Price Surges 13% As Q3 PAT Rises To Rs 767 Crore,news-article,https://www.moneycontrol.com/news/business/stocks/lic-housing-finance-share-price-surges-13-as-q3-pat-rises-to-rs-767-crore-7996281.html,"Net interest income (NII) grew 14 percent to Rs 1,455 crore, as against Rs 1,281 crore for the same period in the previous year. Net interest margin (NIM) improved to 2.42 percent as against 2.36 per cent. Gowd expects Q4 NIM to be at around 2.50 percent.",2022-01-28 11:29:06.000,https://pocket-image-cache.com/direct?url=http://images.moneycontrol.com/static-mcnews/2022/01/housing-finance-770x433.jpg,"{'logo': 'https://assets.tickertape.in/images/news-publishers/moneycontrol.png', 'id': 'www.moneycontrol.com', 'name': 'Moneycontrol'}",[{'sid': 'LICH'}],61f3894e13361b4f7c0d3a65
197,LIC Housing Finance Q3 Review - Volatility Continues Though Surprising Positively This Time: ICICI Securities,news-article,https://www.bloombergquint.com/research-reports/lic-housing-finance-q3-review-volatility-continues-though-surprising-positively-this-time-icici-securities,LIC Housing Finance Q3 Review - Volatility Continues Though Surprising Positively This Time: ICICI Securities,2022-01-28 10:02:12.000,https://pocket-image-cache.com/direct?url=http://gumlet.assettype.com/bloombergquint%2F2019-10%2F102fcf6b-b816-40da-9065-3c99ce1c85e0%2FWhatsApp_Image_2019_10_22_at_14_29_32__1_.jpeg?rect=27%2C0%2C1253%2C658&w=1200&auto=format%2Ccompress&ogImage=true,"{'logo': 'https://assets.tickertape.in/images/news-publishers/bloombergquint.png', 'id': 'www.bloombergquint.com', 'name': 'Bloomberg Quint'}","[{'sid': 'ICCI'}, {'sid': 'LICH'}]",61f372ca13361b4f7c0d3949
198,LIC Housing Finance net profit rises 6% to Rs 767 crore in third quarter,news-article,https://www.business-standard.com/article/companies/lic-housing-finance-net-profit-rises-6-to-rs-767-crore-in-third-quarter-122012701830_1.html,LIC Housing Finance’s (LIC HFC) net profit rose 6 per cent year-on-year (YoY) to Rs 767.33 crore in the third quarter.,2022-01-27 23:53:00.000,https://pocket-image-cache.com/direct?url=http://bsmedia.business-standard.com/_media/bs/img/article/2021-06/15/full/1623761375-9782.jpg,"{'logo': 'https://assets.tickertape.in/images/news-publishers/businessstandard.png', 'id': 'www.business-standard.com', 'name': 'Business Standard'}",[{'sid': 'LICH'}],61f2e80713361b4f7c0d36bf
199,LIC Housing Finance net profit rises 6% to Rs 767.33 crore in Dec quarter,news-article,https://www.business-standard.com/article/companies/lic-housing-finance-net-profit-rises-6-to-rs-767-33-crore-in-dec-quarter-122012701649_1.html,Mortgage lender LIC Housing Finance reported a 6 per cent increase in profit after tax at Rs 767.33 crore for the quarter ended December 2021,2022-01-27 21:59:00.000,https://pocket-image-cache.com/direct?url=http://bsmedia.business-standard.com/_media/bs/img/article/2021-06/15/full/1623761375-9782.jpg,"{'logo': 'https://assets.tickertape.in/images/news-publishers/businessstandard.png', 'id': 'www.business-standard.com', 'name': 'Business Standard'}",[{'sid': 'LICH'}],61f2cbe813361b4f7c0d35ca
200,"Stocks that will see action on January 27, 2022",news-article,https://www.thehindubusinessline.com/markets/stocks-that-will-see-action-today-jan-27/article64941260.ece,"Buzzing stocks: BHEL, Canara Bank, PNB, CG Power, Colgate, Fino Payments, LIC Housing, Nippon AMC, Arvind, ICICI Lombard, JB Chem, SRF, RITES, SH Kelkar, Wockhardt, Rajapalayam",2022-01-27 08:46:52.000,https://www.thehindubusinessline.com/incoming/3jjdmk/article64941265.ece/alternates/LANDSCAPE_615/IMG_PO12_Markets_2_1_25998UOJ.jpg,"{'logo': 'https://assets.tickertape.in/images/news-publishers/thehindubusinessline.png', 'id': 'www.thehindubusinessline.com', 'name': 'The Hindu Businessline'}","[{'sid': 'BHEL'}, {'sid': 'CNBK'}, {'sid': 'COLG'}, {'sid': 'ICIL'}, {'sid': 'LICH'}, {'sid': 'PNBK'}, {'sid': 'SRFL'}, {'sid': 'WCKH'}]",61f20fb913361b4f7c0d2d37
